{
  "$schema": "https://json-schema.org/draft/2020-12/schema",
  "$id": "https://a-lang.invalid/schemas/token-positive-mnemonic/schedule-policy-v1.schema.json",
  "type": "object",
  "additionalProperties": false,
  "required": [
    "format",
    "seed",
    "selected_cases",
    "model_families",
    "repetitions",
    "protocol_conditions",
    "counterbalance_by",
    "primary_cells",
    "max_replacements_per_cell",
    "hard_request_ceiling",
    "definitive_response_retriable",
    "opaque_trial_id_bytes"
  ],
  "properties": {
    "format": {
      "const": "alang-token-positive-schedule-policy-v1"
    },
    "seed": {
      "const": 2026082504
    },
    "selected_cases": {
      "const": 48
    },
    "model_families": {
      "const": [
        "mixtral",
        "ornith"
      ]
    },
    "repetitions": {
      "const": 2
    },
    "protocol_conditions": {
      "type": "object",
      "additionalProperties": false,
      "required": [
        "action-completion",
        "comprehension",
        "diagnostic-repair",
        "generation"
      ],
      "properties": {
        "action-completion": {
          "const": [
            "P0",
            "P1"
          ]
        },
        "comprehension": {
          "const": [
            "P0",
            "P1"
          ]
        },
        "diagnostic-repair": {
          "const": [
            "P0",
            "P1"
          ]
        },
        "generation": {
          "const": [
            "P0",
            "P1"
          ]
        }
      }
    },
    "counterbalance_by": {
      "const": [
        "model-family",
        "protocol",
        "runtime-family",
        "stratum",
        "repetition"
      ]
    },
    "primary_cells": {
      "const": 1536
    },
    "max_replacements_per_cell": {
      "const": 1
    },
    "hard_request_ceiling": {
      "const": 3072
    },
    "definitive_response_retriable": {
      "const": false
    },
    "opaque_trial_id_bytes": {
      "const": 12
    }
  }
}
